가격,평점,채널,날짜,제품명,리뷰
"178,600",평점4,11번가,21.10.13.,2020년형테팔 엑스퍼트3.60 TY6933,"무선청소기 넘 갖고 싶었는데 가격 부담없는 테팔로 구매했어요. 사용 후 장,단점을 남겨봅니다. 1. 배송 엄청 빠릅니다. 2. 할인해서 10만원 이하의 가격으로 구매했는데 가격이 넘 매력적이고 가성비 짱입니다. 3. 흡입력도 좋고 충전만 되어 있음 언제든지 가져다 청소할 수 있어 사용이 편리합니다. 4. 체중이 45kg인데 무게감은 조금 있으나 많이 무겁거나 버겁진 않습니다. 5. 소음은 흡입력이 2단계로 되어 있어 세게하지 않으면 귀어 거슬릴 정도는 아닙니다.  6. 충전시 시간이 오래 소요되는 단점이 있고 유선보단 흡입구가 날렵하진 않아 낮은공간 청소는 불편하며 흡입구가 고정되지 않아 힘없이 이리저리 움직여 좋은 기능이지만 불편함도 있으며 플라스틱 흡입구라 내구성이 신경 쓰입니다 7. 작동시 나오는 바람은 바로 세우지 않고 몸에서 약간 옆으로 비겨 사용하니 그리 신경쓰이진 않습니다.8. 충전기가 조금 부실하지 않나 생각되긴 하지만 이 가격이면 그정도는 감내할 수 있을 것 같습니다.결론적으로 삼*, L*, 다**무선청소기 써 보진 않았지만 이 가격에 이 정도 성능이라면 테팔청소기 강추합니다."
"178,600",평점3,11번가,21.11.11.,2020년형테팔 엑스퍼트3.60 TY6933,장점: 저렴하게 샀다. 카드 할인까지 받아서 94050에 샀다. 가볍다. 기능이 단순하지만 그래서 만족한다. 흡입력은 아주 좋은 건 아니지만 일반 가정에서 사용하기 괜찮다.  유튜에서 다른 청소기들과 비교하는 걸 봤는데 다른 청소기에 비해 소리가 조용한 편이다. 동영상엔 크게 녹음 됨. 단점:  바람이 얼굴로 온다. 이게 매우매우 큰 단점.    다른 상품평에 옆으로 기울여서 사용하면 괜찮다고 해서 나도 그러려고 했는데 별 소용 없다. 청소하는 동안 청소기가 뿜어내는 바람을 직통으로 마시며 청소해야 한다. 나는 그래서 한 손으로 송풍구를 대충 가리며 청소하지만 짜증난다. 필터가 미세먼지를 얼마나 거를지 의문. 요거트 통이라도 덮어야 하나 고민 중. 스스로 서있지 못하고 벽에 붙은 충전기에 끼울 때만 서 있는다. 아무리 봐도 99천원 이하가 적정 가격인 거 같음. ;;;;
"178,600",평점3,테팔,21.09.10.,2020년형테팔 엑스퍼트3.60 TY6933,"장점-가격이 저렴, 배터리 잔량표시됨, 무게가 가볍다.단점-공기청정기나 선풍기인줄..... 얼굴로 먼지거른 바람이 직빵으로 온다. 쎄게온다.힘이 약하다.현재 집에 무선 청소기 3개 사용 중.테팔꺼도 최근에 산거 있는데...이건 가격에 딱 맞는 청소기임.마스크랑 보호안경 쓰고 청소해야 함.무선청소기 여러개 사용중이고 브랜드별로 다 사용해봤지만얼굴로 바람 나오는 제품은 처음 봄.생각이 조금 짧았던 제품.반품 귀찮아서 다른제품 고장나면 사용하려고 충전중.배송은 빨랐음"
"178,600",평점5,11번가,21.10.06.,2020년형테팔 엑스퍼트3.60 TY6933,"배송은 일단 빨랐습니다. 포장상태도 만족하구요.벽에 고정시켜서 청소기를 거치도 할 수 있고 다른 악세사리도 같이 거칠 할 수 있는 것도 좋았습니다.소리는 조용하다고 할 수 없지만, 시끄럽지 않은 편으로 보통 정도 되는거 같네요. 흡입력은 만족합니다. 확실히 소형무선청소기에 비해서는 흡입력이 훨씬 좋구요 일반 유선청소기에 80~90%에 가까운 성능을 보여주는거 같습니다. 러그 위나 카페트 위를 지나갈때 잘 빨아들이네요. 다만 단점이라면 배터리 충전속도가 느립니다. 핸드폰 고속충전이 되는게 보편화되다보니 이런 점들이 불편하게 느껴지네요. 그래도 가격보다 훨씬 좋은 성능과 무겁지 않은 무게감, 테팔이라는 브랜드 이미지... 이렇게 장점으로 볼 수 있겠네요.^^"
"178,600",평점5,11번가,21.04.07.,2020년형테팔 엑스퍼트3.60 TY6933,"6년동안 사용했던 삼성 무선청소기가 갑자기 고장이 나서 급하게 찾아보다가 저렴한 가격에 나와서 바로 구매했어요! 사실 십만원도 안되게 사서 많이 기대 안했는데... 진짜 생각보다 좋아요! 쓸데없어 보였던 빛이 생각보다 먼지 자세히 청소하는데 도움이 되네요. 쓱쓱 청소기 밀어도 잘 청소되고요 소리는 우리가 생각하는 청소기들의 소음보다 적은 편이라 맘에 들어요. 아쉬운 점은 얼굴로 바람이 온다는 건데... 리뷰보고 알고서 산거지만 이게 의외로 신경이 많이 쓰이네요. 먼지바람이 내 얼굴로 직빵으로 오는듯한 느낌?ㅋㅋㅋ 그리고 먼지통이 투명해서 먼지들이 다 보이는게 좀 아쉽긴 하네요. 배터리 충전하는게 좀 부실해 보이고, 저희 집은 벽에 구멍 뚫는거 안좋아해서 그냥 놓고 충전하는데 그러다 보니 깔끔해보이지가 않네요. 하지만 청소기 자체로서의 기능은 가격대비 최곱니다!"
"178,600",평점4,11번가,21.11.12.,2020년형테팔 엑스퍼트3.60 TY6933,11절 딜로 99000원으로 구매했습니다 장점은 무선이여서 편하고 모터세기가 쎈거 같습니다 조립도 생각보다 편해서 여자들도 쉽게 조립 가능할 거 같습니다단점은 바람이 얼굴로 나오는점 거치대가 허술해서 요즘 못질 못하는 집에서는 설치하기 난감할 거 같습니다 못도 안들어있고요 그리고 길이조절을 할 수 없고 직접 헤드와 봉을 빼서 길이 조절을 해야 한다는 점 입니다그래도 가격적인 면을 생각한다면 튼튼하고 디자인도 깔끔하고 안에 필터도 분리되어서 나중에 세척도 편리 할 거같습니다~ 가성비 제품입니다 ㅎㅎ
"178,600",평점1,11번가,21.12.21.,2020년형테팔 엑스퍼트3.60 TY6933,청소기 제대로된것 사고싶어서 고루고 고ㅡ른게 데팔청소기다단점: 1.청소기를 가동시키면 얼굴로 먼지가 올 라온다(기분 더럽다)2.청소기필터 빼기가 너무힘들고 어렵다청호기 필터뺄때마다 욕나온다도대체 왜 이따구로 만들었을까?필터 교환이 가능한지도 모르겠다귀찮아서 청소기 돌리기가 싫다중국산 저렴한것도 써봤는데 오히려 저렴이가 낫다데팔청소기  최악이다
"178,600",평점5,11번가,21.10.06.,2020년형테팔 엑스퍼트3.60 TY6933,"무선이라 그런지 유선대비 힘이 약하긴하지만 청소 잘되네요. 핸들부분에 모터가있어 살짝 묵직하긴한데 흡입구 부분이 컨트롤 잘되서 청소하기 힘들지 않았어요. 단, 충전하고 '강' 으로 15분정도 청소했더니 배터리가 나가더라구요. 충전 다시하고 나머지 청소했는데 평소보다 청소속도를 올려야겠다 싶어요. 소음은 살짝 크긴한데 다른 무선청소기랑 비슷한 정도이고 다른리뷰에서 언급된것처람 바람이 얼굴로 오는거랑 홀딩하기 힘든게 단점이긴해요. 그래도 저렴한 가격에 구입했으니 가격대비 나쁘지않은거 같아요."
"178,600",평점5,11번가,21.11.11.,2020년형테팔 엑스퍼트3.60 TY6933,일단 무선을 10만원도 안되는 가격에 사서 만족해요 써보니 유선보단 해드가 무거운게 좀 아쉬워요 근데 쓸때마다 일일이 선을 꽂지않아도 되니까 쉽게 쓰기 너무 좋아요 흡입력도 나름 괜찬구요 근데 흡입판이 작은 솔같은게 달려서 구르면서 빨아들이네요 그러다보니까 긴머리 카락은 돌돌 감기는게 많아서 한번씩 빼줘야하는게 좀번거롭네요 다른건 걍 쓸만해요
"178,600",평점1,테팔,21.11.22.,2020년형테팔 엑스퍼트3.60 TY6933,청소기 공기순환이 위로 나오는 경우도 있네요.청소기가 아니고 쓰레기를 샀어요.ㅠㅠ청소하는 내내 바람이 얼굴을 강타..테팔은 청소기 왜 만들죠?후라이팬 기술자가 청소기까지 만드나요?다른제품들 사세요..구매는 먼지바람이 좋으신분들만 사는걸로..
"178,600",평점5,테팔,21.12.23.,2020년형테팔 엑스퍼트3.60 TY6933,가성비 너무 좋아요! 리뷰보고 테팔로 맘 굳히긴 했지만 진짜 솔직후기입니다ㅎㅎ 배송은 월요일 오전10시 주문해서 수요일 오후에 받았어요한칸정도 충전되어서 온것같은데 생각보다 넘 가볍고 작은 먼지들까지 다 청소되네요 가성비 넘쳐요ㅎㅎㅎ굳이 이가격에 아쉬운거 꼽자면 앞부분이 플라스틱이라 깨지면 사용 못할것같아서 약간은 조심조심~키가 큰편이라  이 가격에 완전 만족합니다! 고민이신분 얼른 겟하세용ㅋㅋ내돈내산 찐후기
"178,600",평점5,테팔,21.08.15.,2020년형테팔 엑스퍼트3.60 TY6933,본가에서는 다이슨을 쓰는데 가격이 너무 부담스러워서 테팔 엑스퍼트를 구매 했습니다. 고양이 모래도 흡수 잘되고요 ㅎㅎ 무엇보다 러그에 쌓인 먼지들도 다 흡수가 됐습니다. 샤기러그를 쓰는데 이젠 먼지 털러 안가도 돼서 너무 좋아요. 나중에 결혼할때 이친구 데려가려고 합니다! 많이 파세요!!
"178,600",평점4,테팔,21.08.28.,2020년형테팔 엑스퍼트3.60 TY6933,배송빠르고 잘받았어요.청소기 흡입력도 무선청소기들 비교하면 완전좋아요.별하나 뺀거는 청소기 거치대가 너무 약하고 허술해요.대충 거치대느낌. 나사박고 고정은 했는데 부속품 꽂는곳이 약해서 꽂는거라기 보다는 걸친다는 느낌 ?그리고 청소기 꽂는 곳 라인쪽에 살짝 프라스틱이 부셔져서왔네요...쓰는데 지장없을거 같아서 그냥 씁니다.그리고 리뷰데로 바람이 얼굴쪽으로 많이와요.다음에는 바람하고 거치대 개선좀 부탁드립니다~
"178,600",평점5,11번가,21.10.17.,2020년형테팔 엑스퍼트3.60 TY6933,라이브방송보고 구매했는데 저렴한 편에 테팔이니 브랜드도 믿을만하고 소음도 적당해요핸들링 좀 가벼운감 있으나 그래서 전체 무게도 가벼워요아쉬운건 바람 나오는곳이 옆면이었으면 얼굴부분이랑 안부딪힐텐데 하는 아쉬움이 있네요 가성비 흡입력도 배송도 만족합니다
"178,600",평점5,11번가,21.04.03.,2020년형테팔 엑스퍼트3.60 TY6933,라이브로 저렴하게 구입했고요. 가벼워서 일단 좋아요.기존에 일렉트로닉스 사일런트 청소기를 사용하다보니 무거워서 매일쓰는게 힘들어서 무선청소기를 사려했는데 테팔이라 믿고 구입했어요.소음은 기존청소기랑 비슷한정도로 느껴졌고 청소는 잘빨아들이네요.그리고 정말 가볍고 잘밀려서 좋아요. 아쉬운점은 거치대를 따로 사야하는데 같이 판매하셨음 좋았겠어요.구매자들에게 좀 저렴하게 판매하시던지요. 집 벽에 나사박아가며 거치대  설치할수있는  집이 얼마나 있을까 싶어요..거치대가 없어서 편하게 못세우는게 가장 아쉽네요.판매하는곳 알려주심 구입하고 싶어요
"178,600",평점4,11번가,21.04.02.,2020년형테팔 엑스퍼트3.60 TY6933,가격대비 만족스러워요. 배송은 정말 빨라서 어제저녁 5시 주문해서 오늘 오후 1시에 받자마자 충전해서 바로 사용해봤는데 소음은 생각보다 크지 않아서 괜찮구요 흡입력은 아무래도 유선 보다는 세지는 않지만 미세먼지등은 잘 흡입 되는거 같아요. 바람은 나오기는 하는데 그닥 얼굴로 향하지 않아서 크게 신경 쓰이는 정도는 아닙니다. 그런데 예상외로 LED가 유용하게 쓰이네요. 어차피 낮에 청소하는 거라 크게 쓸데 없을거 같았는데 낮이여도 곧잘 보여서 좋네요. 근데 새제품인데도 led불빛이 좌우가 다른데 왜 그럴까요
"178,600",평점5,11번가,21.11.14.,2020년형테팔 엑스퍼트3.60 TY6933,가성비 너무 맘에 듭니다!A9을 쓰고있고 보조제품으로 구매한건데 너무 만족 스럽습니다.소음도는 보통이고 흡입력도 괜찮은 편이예요-구석에 어두운 곳을 보조하는 등도 편리하고 맘에듭니다!충전대를 걸어둘 공간이 필요해서 그 점이 좀 아쉽네요-
"178,600",평점4,11번가,21.11.19.,2020년형테팔 엑스퍼트3.60 TY6933,가볍고 흡입력은 좋지만 청소할 때 나오는 미세먼지를 제가 먹고있다는 느낌이 들 정도로 바람이 정확히 얼굴로 와요! 그리고 거치대겸 충전기 벽에 못박고 설치해야해서 불편합니다. 하지만 가격대비 이정도로 가볍고  흡입력 좋은 제품 찾기 쉽지않아 만족합니다.
"178,600",평점1,11번가,21.10.03.,2020년형테팔 엑스퍼트3.60 TY6933,처음써보는 상품이라서 기대가 너무 많았는데요다른걸 다 떠나... 흡집이 좀 많은데....사진찍는것도 반품하는것도 그냥 그 모든과정이귀찮은 상황이라서 그냥 쓰겠습니다사실 가격은 너무 싸게 구입이？瑛릿歐楮？이런 후기조차 잘 안쓰는 사람입니다만은상황자체가 좀 성질나서 글은 남깁니다
"178,600",평점4,테팔,21.09.13.,2020년형테팔 엑스퍼트3.60 TY6933,사실 성능도 금액에 비해 좋고 청소한후 처리과정도 괜찮아요.다만 청소기 필터를 통과한 바람이 너무 얼굴쪽으로 나와서 사실 신경쓰이긴 해요. 가끔 재채를 심하게 할때도 있고요.추후 업그레이드버젼이 혹시 나온다면 그점은 꼬옥 개선해주셨음합니다.
"178,600",평점4,11번가,21.11.02.,2020년형테팔 엑스퍼트3.60 TY6933,"고정할 거치대 조립할 때 설명서가 너무 부실하고 나사 조임이 어려운 단점이 있었지만 그래도 청소기 성능 자체는 만족할 만 했습니다. 너무 편하고 좋아요. lg나 삼성같은 회사 청소기만큼 가볍지는 않는데, 그래도 이정도면 쓸만합니다. 추천해요."
"178,600",평점1,11번가,21.10.21.,2020년형테팔 엑스퍼트3.60 TY6933,장점은 생각보단 무겁지 않다는점이고 단점은 청소기바람 배출하는곳이 바로 상단 얼굴을 향해 있어 매우 분편했으며 브러쉬가 밀착형 천브러쉬인줄 알았는데 솔브러쉬라  바닥에 밀착되지 않아 흡착력이 매우 떨어짐 저희집이 방화마루라 더욱더 밀착이 안되었슴..
"178,600",평점5,11번가,21.10.15.,2020년형테팔 엑스퍼트3.60 TY6933,청소기만 돌리면 죽일듯이 ？i아오는 갓아지가이 청소기는 시큰둥하네요  조용해요ㅋ가볍고 청소하기도 쉽네요머리카락빼내기도쉽고 먼지망 청소도 필터는 물청소가능하고 ....거치대에 추가청소용품을 같이 끼워둘수있어  잃어버릴염려도 없겠네요몇년은  고장없이 잘쓰면 더 좋겠네요
"178,600",평점5,테팔,21.08.26.,2020년형테팔 엑스퍼트3.60 TY6933,주문하자마자 바로 배송처리되어서 다음날 배송 받았어요. 생각보다 크고 ? 생각보다 가벼워서 잘 쓰고 있어요. 충전 단자가 무조건 못을 박아서 사용해야하는데 그점만 조금 아쉬워서 어떻게 해야 좋을지 고민 중입니다. 감사합니다 ^^
"178,600",평점5,11번가,21.04.02.,2020년형테팔 엑스퍼트3.60 TY6933,"일단 배송 겁나게 빠르구요,  오자마자 충전해서사용하니 흡입력은 좋은데 역시 키작은 저에겐 뒤바람이 직빵으로 오네요. 머리말릴 정도로 바람이 세서혹시나 봤더니 셋팅이 맥스로 출고되나봐요.바람나오는 뒤 빨간버튼 누르면 조절가능한데표준으로하니 한결 낮긴한데 청소기능은 어떤지낼 다시 해봐야겠어요. 아주 가볍지는 않은것같고가격은 대박 만족합니다.as맡길일 없이 오래사용하길 바랄 뿐이예요.맥스로 카페트청소는 정말 잘되네요."
"178,600",평점5,11번가,21.04.04.,2020년형테팔 엑스퍼트3.60 TY6933,우선 배송이 정말 빠르네요. 주문하고 바로 다음날에 와서 깜짝 놀랐어요. 포장도 꼼꼼하게 잘 되어있었어요. 무선청소기를 처음 구입해봤는데 유명한 다o슨이나 큰 차이는 없었어요. 무게도 그리 무겁지 않고 소음은 그냥 청소기에서 일반적으로 나는 정도예요. 다o슨도 소음이 꽤 있더라구요. 앞부분에 led가 있어서 좀 있어보이는 것 같아요. 거치대가 세워지는 게 있음 더 좋았겠지만 가격이 워낙 저렴하다보니 이 정도도 만족합니다. 남편이 거치대를 벽에 붙인다고 말도 안 하고 벽에 구멍을 내놔서 좀 짜증이 났지만 그것 말고는 만족해요.^^
"178,600",평점3,G마켓,21.02.12.,2020년형테팔 엑스퍼트3.60 TY6933,장점 : 흡입력은 좋음. 좌우 자유롭게 헤드가 움직여서 청소가 용이함단점: 작동중에 바람이 청소하는 사람의 얼굴로 와요. 그리고 청소기의 세기가 강약 조절되는게 없이 on 아니면 off로만 작동되네요.또한 전원 버튼이 손잡이 부분에 있어서 손잡이 잡고 청소하다보면 자꾸 전원 버튼을 눌러서 끄게 되네요. 전원 버튼 위치가 ㅠㅠ청소기 소음은 일반적으로 청소기 작동할때 나는 정도의 소음 정도에요.그런데 제가 받은 청소기가 문제가 있는건지 청소기 작동중에 헤드부분에서  아무것도 없는 상황인데도 불구하고 청소기가 비닐같은것을 흡입할때 내는 불편한 소리를 내어서 청소기를 작동하는 중간중간 내고 있습니다.
"178,600",평점5,11번가,21.04.02.,2020년형테팔 엑스퍼트3.60 TY6933,무선 청소기 구매 하고 싶었는데 삼성 다이슨은 비싸서 구매할까 말까 고민하다 구매 포기 했는데 이번에 라이브 방송 특가로 나와 엄청 저렴하기도 하고 예전에 무선청소기 평가 평점 테팔 무선청도기도 좋았던걸로 기억되서 구매했어요.일단 배송은 엄청 빠르네요. 라방때 구매해서 오후 6시 다되서 구매 했는데도 오늘 오후2시 30분 이전에 도착했어요. 청소기 배터리 무게 때문인지 가볍진 않고 벽거치대는 나사 미포함이고 청소기 켜면 윗쪽에서 바람이 많나오는 점이 아쉽지만 헤드에 큰 바퀴 달린거 헤드가 옆으로 잘꺽이는거 led 불 들어오는거 흡입력 좋고 소음이 생각보다 크지 않은게 좋네요.
"178,600",평점5,11번가,21.10.06.,2020년형테팔 엑스퍼트3.60 TY6933,"정말 가볍고 좋아요! 그동안 청소포로 쓸다가 청소기로 침대만 쓸어주었는데도 먼지가 한가득 나와서 찐당황;;;가벼운 편인데 흡입력도 너무 좋아서 만족해요!!거치식 충전인게 단점이지만, 창틀에 걸어서 잘 사용하고 있네요 ㅎㅎ11번가 라이브 첫 구매인데 좋은 제품 좋은 가격에 구매해서 대만족입니다~!!!"
"178,600",평점4,11번가,21.04.04.,2020년형테팔 엑스퍼트3.60 TY6933,배송은 총알임1단은 너무 약해서 2단으로 쓰는데2단 소리가 시끄럽지 않고 잘 빨아들임핸들은 부드럽다기보단 휙휙 나가는 느낌브러쉬가 돌돌이가 아닌 빗이라 그런듯싶기도다@@도 써봤지만이정도면 가격대비 훌륭함최대 단점인 바람이 얼굴로 나오는 건좀 눕혀서 쓰면 괜찮음무겁지 않고 윗부분이 날렵한 디자인이라스텐거치데에  똑바로 세워져서 좋음
"178,600",평점4,11번가,21.10.13.,2020년형테팔 엑스퍼트3.60 TY6933,여기저기 가격비교하고있었는데 11일날  할인받아 구매해서 너무 좋아요. 바람이 얼굴로 나온다해서 걱정했는데 댓글처럼 심하지않아 다행. 예전 하부중심테팔청소기 사용하다 요거사용하니 너무 가볍고 좋아요. 가격대비 만족
"178,600",평점5,테팔,21.03.21.,2020년형테팔 엑스퍼트3.60 TY6933,왜 진작안샀는지..휴..마트가서 한번 만져보고 인터넷으로 사긴했는데. 원래 유선 청소기 썼는데 무겁기도하고 선으로 연결하고 그래서 좀 빡쳐있다가 무선청소기 그냥 적당한거사자 해서 찾았는데 성능도 좋고 그냥 좋아요 가격대비 좋아요 자취템 강츄
"178,600",평점5,11번가,21.10.02.,2020년형테팔 엑스퍼트3.60 TY6933,"어제인가 주문했는데, 총알배송이네요 ㅋㅋ남편 몰래 사서, 오늘 낮에 숨겨놓다가.. 마음에 찔려서....저녁에..불었어요..기존 무선청소기가 너무 무겁고 30만원 넘게 줬는데도,,,, 지금은 먼지를 먹지 못하고 계속 뱉어서 화나서.. 믿는 테팔이고 가격도 저렴해서 지금 꼭 사야했다고~~♡이벤트 당첨되면 최고라고.. 으헝.. 이벤트 당첨？瑛？ 더 좋겠어요~ 어쨌뜬 남편한테 들키고나서 남편이 개봉했고, 저는 말했죠. 내가 개봉안했다고 ㅋㅋㅋㅋㅋ 남편이 이쪽 저쪽 해보더니 깨끗하게 청소되는걸 보더니!!! 잘샀대요!!!!♡.♡ 휴~:-) 다행이댜♡"
"178,600",평점3,11번가,21.11.13.,2020년형테팔 엑스퍼트3.60 TY6933,배송 하나는 진짜 짱이었어요 ㅋㅋ 오전에 주문하자마자 그 다음날 배송 도착 문자가 오더군요. 시운전했을 때 중량은 가벼웠으나 어느 분이 리뷰에 바람이 위로 나와 얼굴쪽으로 나와 조금 불편하가는 글을 봤는데 .. 역시나 ㅠㅠ 얼굴쪽으로 바람이 나와 그건 좀 불편합니다. 그것만 빼면 가성비 괜찮은 거라고 봐요
"178,600",평점5,11번가,21.04.03.,2020년형테팔 엑스퍼트3.60 TY6933,배송른 빨랐어요. 포장도 겉에 박스로 한번 더 포장되어 만족합니다.제품도 각각 안전하게 잘 포장되어 있네요.가벼워서 청소할때 힘이 별로 들지 않아 만족합니다.다이슨보다 손에 힘이 덜 들어가요. 장단점이 될 수 있지만 버튼은 누르고 있지 않아도 원터치로 작동되어 저는 만족합니다.소리도 생각보다 크지않아요. 잠깐돌렸는데 머리카락이며 먼지가 많이 쌓여 있네요...ㅋㅋ다만 필터가 헤파필터가 아닌게 아쉽네요.가격대비 성능이 좋아 아주 ?합니다.
"178,600",평점4,11번가,21.04.02.,2020년형테팔 엑스퍼트3.60 TY6933,에어포스 360을 2년넘게 사용하다 청소기 노후화로 특가라 구매했는데 진짜 가볍네요 흡입구 솔이 에어포스360은 주기적인 머리카락 및 이물질 제거가 필요한데 엑스퍼트3.60은 청소가 필요없어 편리하네요 먼지통 제거하는것도 에스퍼트3.60이 편함가격대비 에어포스 360보다 가성비는 좋은듯합니다 하지만 마감이나 만듬세는 360이 무겁지만 조아요 계속 비교하며 사용해볼게요 득템한 기분입니다
"178,600",평점4,11번가,21.04.05.,2020년형테팔 엑스퍼트3.60 TY6933,헤드부분 유연하고 좋아요.가볍다 정도는 아니지만 한손으로 사용하기 어려움 없는 무게입니다.5시간 충전하면 세기 강하게 하여 17분 사용가능합니다.15평 집.바닦 정리 다 해놓고 돌리니 10-15분 정도면 청소완료 할수있어 아직은 괜찮으나 아무래도 배터리가 1-2년 사용할수있는 소모품이니 장기적으로 보면 조금 아쉬운 점입니다.
"178,600",평점3,11번가,21.04.05.,2020년형테팔 엑스퍼트3.60 TY6933,바람이 얼굴로와요. 나중에 사용감있을땐 사용하기 찝찝할꺼같은 불안감이있습니다. 그것빼고는 괜찮아요. 완충하고 두번사용했는데 중간에 꺼짐이 4번정도 발생했어요. 실수로 전원버튼을 누른건지 아님 충전불량인건지 몇이 더 테스트해보겠습니다.
"178,600",평점5,11번가,21.02.19.,2020년형테팔 엑스퍼트3.60 TY6933,TV홈쇼핑보다 엄마가 주문하래서 인터넷검색했더니 색상이 다른 것이라서 몇번이나 그 기종이 맞는지 확인해보고 주문했어요.밑에 입구 쪽이 자유자재로 움직여서 카페트등 잘 조종해야겠더라구요.요즘은 중간 막대 부분을 빼고 가볍게 사용하고 있어요.모바일상품권 발송해주셔서 정말 감사합니다.
"178,600",평점5,11번가,21.04.02.,2020년형테팔 엑스퍼트3.60 TY6933,구입 안했으면 후회할뻔 했네요.완전 훌륭합니다.소음도 적당하고 마감도 깔끔하고 흡입력도 양호합니다.허접한 수입산과 비교불가~~집청소하시느라 힘들어 하시는 어머니께 많은 도움이 될듯 합니다.거치대가 바닥에 있으면 더 좋았겠지만 마침 위치가 가벽이라 쉽게 설치했네요.
"178,600",평점5,11번가,21.04.07.,2020년형테팔 엑스퍼트3.60 TY6933,가격대비 좋아요배터리가 더 비싸서 갈진 못하겠고 한 2년쓰다 배터리 나가면 이거 다시 사는게 좋겠죠 ㅋ9만9천원에 산건데 배터리가 11만원이래서 ㅋㅋㅋ가볍진 않아요 보통 무선청소기 무게예요흡입력 좋고 저렴하고 잘샀어요
