가격,평점,채널,날짜,제품명,리뷰
"128,990",평점4,11번가,21.07.16.,테팔 TY6545KL,장점: 무선이라 구석구석 청소 할수 있고 흡입력 좋아요 . 흡입력 강/약 조절 할수 있어요.단점: 개개인의 차이겠지만 무거워요. 청소할때 팔이 아파요. 충전시간 오래 걸리고 배터리 진짜 빨리 없어져요. 한번 충전하고 청소기 강으로 한번 돌리면 배터리도 끝.청소기 돌리고 충전기로 계속 충전하면 상관 없을듯 해요 .첨엔 배터리 너무 빨리 없어져서 불량 인줄 알았는데 설명서 보니 사용시간:(약) 30분/(강)13분 으로 되여 있는거 보니 불량은 아닌듯 해요 .
"128,990",평점5,GSSHOP,21.03.03.,테팔 TY6545KL,자동으로 세워져서 좋구용!무선 처음 사용해보는데 넘 편하네영!딱 달라붙어있는건 안 빨아들여져도 먼지나 머리카락정도는 다 빨아들여용~소음이 좀 있는편인데 원룸에서 사용해서 조금만 사용하기때문에 상관없구용 앞에 불빛이 나와서 더 편한거 같애용~ 잘쓰겠습니당!!
"128,990",평점5,CJ온스타일,21.03.02.,테팔 TY6545KL,정말 만족스럽습니다.청소기로서의 기능은  모두 제대로 수행하는 착한청소기입니다.약간의 소음은 감수할정도이고 뒷정리도 간편합니다.쓰레기저장통 한번씩비우고 씻어주면 한동안은  깔끔하게 사용할수도 있고요.구매강추^^
"128,990",평점1,GSSHOP,21.07.18.,테팔 TY6545KL,구매한지 2달이 좀 되었습니다. 처음부터 빨아들이는 힘이 좀 약해서 이상했는데오늘은 작동이 멈췄습니다. 구매하고 청소기는 대략 3-5회 정도 각각 15분 내외로 사용했습니다. 처음부터 배터리 불량품을 보내준 것 같습니다. 환불처리해주거나 혹은 교환해주세요.
"128,990",평점5,GSSHOP,21.05.06.,테팔 TY6545KL,가성비 만족합니다!소리가 크다는 후기들이 몇몇 보여서 얼마나 클까걱정했는데 저희집은 여태 썼던 청소기들 중 소리가 제일 작은 것 같네요.물론 소파 등 가구 아래까지는 청소할 수는 없지만 웬만한 먼지 흡수는 다 되는 것 같습니다.저는 가성비 만족입니다!
"128,990",평점3,GSSHOP,21.02.28.,테팔 TY6545KL,데팔무선청소기가 좋다고해서 구입했는데...아무리 수입제품이라고해도 한글 설명서 한 자도  없다니...ㅜㅜ온통 아랍어같은글ㅜㅜ  기본적인 설명서는 요즘  동봉 되어있다고 알고 있는데...고객센터에 문의해도 자세히 모른다 하시니...해결은 했지만 설명가서 있다면  아쉬운 점  이네요
"128,990",평점3,옥션,21.09.15.,테팔 TY6545KL,배송받고 작동되기에 구매확정햇더니 충전이 안되서 판매자에게 문의하니 답변도 느리고 구매자에게 서비스센터가서 확인받아오라 구매사이트에 반품요청하라 초기불량 물건 받아서 불편한데 뒤처리를 구매자에게 떠넘기는건 아니라고 봅니다 많이 불쾌합니다
"128,990",평점5,SK스토아,20.12.10.,테팔 TY6545KL,적립금이 있어 기분좋게 구매했습니다 청소기 이름에 라이트가 왜 있나했는데 진짜 가볍습니다  손목에 부담이 전혀 없네요 특별한 노즐이나 기능이 없는 딱 기본 청소만 잘하는 청소기를 찾고 있었는데 딱 좋습니다 잘 쓰겠습니다 
"128,990",평점5,롯데홈쇼핑,20.03.18.,테팔 TY6545KL,대박이가격에 이 좋은걸 샀어요..1.가볍다2.힘좋다3.스택드형태라 별도 거치대없어도 된다4.가격이 부담스럽지 않다5.기존은 위쪽이 무거웠는데 그렇지 않아 사용할때 손목 무리없음다이슨V10 사용중입니다.기존 테팔은 임시용이었는데이번에 산 테팔은 메인이 될거 같아요^^
"128,990",평점4,11번가,20.06.24.,테팔 TY6545KL,"조립이 엄청 간단하고, 충전이 살짝 되어있어서 바로 돌려봤네요. 소음은 아주 크지도 작지도 않고요. 흡입력은 보통이에요. 초코과자가루 바닥에 살짝 붙은 건 잘 못 빨아들이고, 머리카락이나 먼지는 잘 흡입해요. 무엇보다 엄청 가벼워 좋네요. 가성비 훌륭해요."
"128,990",평점5,옥션,20.03.06.,테팔 TY6545KL,빨간색 쓰다가  배터리교체할때도 된것같고 배터리값도  비싸서  그냥 새걸로 주문했는데  검정색이라 새롭네요 우선 두개놓고 사용하면 더편리할것같네요  거치대도 필요없고 좋습니다 여기가 젤 저렴  무지가격차이나네요  가격이 더떨어졌군요  이럴수가...그렇게나 많이  억울~~~
"128,990",평점5,테팔,21.08.31.,테팔 TY6545KL,좋아요 불도 들어오고 물히고 회전해서 침대 안쪽도 청소할수 잇고 잘쓰겟습니다!
"128,990",평점5,테팔,21.11.04.,테팔 TY6545KL,저렴하게 잘 샀습니다. 근데생각보다 힘은 약해요ㅠ
"128,990",평점5,테팔,22.01.07.,테팔 TY6545KL,무게중심이 아래에 있어 가볍게 느껴지고 혼자서도 잘 서있네요. 먼지통이 생각보다 커서 자주 비우지 않아 편리하지만 조금 작아도 좋을듯.  색상도 깔끔하고  다 좋은데 충전기 꽂는 게 쬐끔 불편하네요~
"128,990",평점4,테팔,21.12.30.,테팔 TY6545KL,덜그럭소리엄청나요ㅜ
"128,990",평점4,테팔,21.12.16.,테팔 TY6545KL,소음이 커요거치대없이 잘 세워집니다흡입력도 나쁘진 않아요
"128,990",평점5,테팔,21.12.27.,테팔 TY6545KL,생각보다 파워쌔서좋아요
"128,990",평점4,테팔,21.12.15.,테팔 TY6545KL,목이 잘꺽여서 살짝불편아랫집에서 기계소리 어마무시하게 난다고 문에 쪽지써붙임 나는가격대비만족
"128,990",평점5,테팔,21.11.30.,테팔 TY6545KL,간단한 청소하려고 샀어요^^흡입은 유선에 비해 좀 약하지만 아이들때문에 수시로 간편하게 청소할수 있어 좋네요.자리 차지도 안하구요~~
"128,990",평점5,테팔,21.08.05.,테팔 TY6545KL,"이사가면서 새로운 청소기 구매로 사봤어요; 아직 안써봤지만 배송은 빠르구 좋아요, 사은품도 감사합니당"
"128,990",평점5,테팔,21.12.02.,테팔 TY6545KL,배송도 빠르고 쓰던제품 다시구매했어요
"128,990",평점4,SK스토아,21.03.03.,테팔 TY6545KL,가격대에 비해서 흡입력 맘에 듭니다.부모님 유선청소기 끌고다니기 힘드셔서 심사숙고끝에 선물해드렸어요~~ 앞부분 들리는건 세우지 않는이상은 문제되지 않아요.. 잘 쓸것같아요~~
"128,990",평점5,테팔,21.11.13.,테팔 TY6545KL,자취생들에게 좋은듯해요소음도 보통이고잘 되여 아주혼자 잘세워지고너무너무 좋아욤
"128,990",평점5,테팔,21.11.11.,테팔 TY6545KL,강약 조절 할 수 있는데 늦은 시간에 집 들어올때 약으로 돌리면 소음이 아주 작아서 급할때 쓰기 좋아요!
"128,990",평점4,테팔,21.11.02.,테팔 TY6545KL,배송이 엄청 빨라요. 기존 쓰던 제품이 베터리 고장으로 구매했는데 오래사용했으면 좋겠어요.
"128,990",평점5,테팔,21.06.26.,테팔 TY6545KL,할인받아 타사이트보다 저렴하게 구입 농장 컨테이너에서 사용중인데 가볍고 쓰기 편해요추천
"128,990",평점5,테팔,21.11.05.,테팔 TY6545KL,청소통 비우기 간편해서 좋아요~ 자취생에게 딱
"128,990",평점5,테팔,21.11.09.,테팔 TY6545KL,음 배송도빠르고 조립도간단해용
"128,990",평점5,테팔,21.10.24.,테팔 TY6545KL,배송도 빠르고 이상없는 제품으로 잘 받았습니다. 무게감도 많이 느껴지지 않고 머리카락이나 먼지등도 잘 빨아들이네요!! 고장없이 오래도록 잘 사용했으면 좋겠네요-!!
"128,990",평점5,테팔,21.10.31.,테팔 TY6545KL,완전 흡입력 좋아서 먼지 다 빨아들이고 밑이 막대기? 빼서 머리카락 뺄수 있어서 평해요
"128,990",평점4,테팔,21.10.25.,테팔 TY6545KL,앞에 고개가 돌아가서 침대아래밀때 불편한거빼곤 좋네요 ㅎ
"128,990",평점5,테팔,21.10.31.,테팔 TY6545KL,흡입력도 좋고 디자인도 깔끔하고 만족도 높아요!
"128,990",평점5,테팔,21.10.31.,테팔 TY6545KL,두번째 구매했는데 완전만족해요
"128,990",평점5,테팔,21.10.21.,테팔 TY6545KL,배송빠르고 포장꼼꼼해요
"128,990",평점5,테팔,21.10.16.,테팔 TY6545KL,가성비 좋아요~ 사용 시간이 짧아 고민했는데 청소해 보니 그리 짧지 않네요. 거치대없이 세워둘 수 있어 더 좋고요 ^-^
"128,990",평점5,테팔,21.10.12.,테팔 TY6545KL,동일모델 레드제품 3년쓰니 성능이 떨어지내여베터리교환해야 할듯 싶은데 가격이 새제품 쓰는게 더 이득이내여ㅎ그래서 이번엔 블랙으로 구매~
"128,990",평점5,테팔,21.10.19.,테팔 TY6545KL,디자인 고급지고 가격 착하고 써보고 선물하느라 4개째  구매입니다 다들 c아하네요
"128,990",평점5,테팔,21.10.14.,테팔 TY6545KL,처음 써보는데 다시 재구매 글이 많아서 결정했습니다평일 간단히 청소할 목적으로 산거라 만족합니다~
"128,990",평점5,테팔,21.10.30.,테팔 TY6545KL,항상 잘 쓰고잇어요 필터 청소 물로 하고 말리고잇어옹
"128,990",평점4,테팔,21.10.09.,테팔 TY6545KL,소리가 다소 큰거 외에는 만족합니다
"128,990",평점5,테팔,21.10.12.,테팔 TY6545KL,좋은제품 빠른배송 감사합니다
"128,990",평점5,롯데ON,21.12.28.,테팔 TY6545KL,좋아요 맘에들어요   단지 소리는 조금 큰것같네요거치는 단독으로도 가능하네요 추천합니다
"128,990",평점5,테팔,21.10.10.,테팔 TY6545KL,굿굿굿 좋긴한데 그냥저냥
"128,990",평점5,CJ온스타일,21.09.29.,테팔 TY6545KL,재구매 할 정도입니다가볍고 청소 잘되고소리먼 조금더 적으면 좋겐ㅅ습니다
"128,990",평점5,테팔,21.09.28.,테팔 TY6545KL,가격도 마음에 들고 품질도 좋아요
"128,990",평점4,테팔,22.01.04.,테팔 TY6545KL,이전도면 가격대비 쓸만합니다
"128,990",평점5,테팔,21.09.27.,테팔 TY6545KL,와 가성비값이에요!! 다른 비싼무선청소기에비해 가볍고 흡입력도 결코 밀리지않아요! 너무 만족스러워요~
"128,990",평점2,테팔,21.09.23.,테팔 TY6545KL,밧데리 완전 빨리 닳아요 ㅠ제조일 안적혀있을때 의심했어야하는데...재고떨이인 기분이 드네요 ㅠ
"128,990",평점5,옥션,22.01.03.,테팔 TY6545KL,빠른 배송 감사합니다. 사업 번창하세요^^
"128,990",평점5,GSSHOP,21.09.26.,테팔 TY6545KL,테팔무선청소기 집에서 쓰고있어요그래서 부모님댁에 선물했습니다오래잘쓰셨음 좋겠어요제가사용하고있는거 사진첨부했어요
"128,990",평점5,테팔,21.09.27.,테팔 TY6545KL,자취생에게 적극 추천해요~ 먼지통 비우기도 쉽고 흡익력도 좋아요
"128,990",평점5,테팔,21.12.30.,테팔 TY6545KL,한달샤용후기입니다 잘돌아가고 어른신분이 쓰기에도 좋아요
"128,990",평점5,테팔,21.09.25.,테팔 TY6545KL,가격대비 품질도 좋고 좋은것 같아요.
"128,990",평점5,테팔,21.09.01.,테팔 TY6545KL,가격대비 대만족입니다
"128,990",평점4,테팔,21.09.20.,테팔 TY6545KL,잘구매한것같아요 ~
"128,990",평점5,테팔,21.09.06.,테팔 TY6545KL,굿굿굿 너무좋아요 가성비값인듯합니다 아직써본진않았지만
"128,990",평점5,테팔,21.09.06.,테팔 TY6545KL,배송 빨라요~ 청소기도 잠시 사용해 봤는데 흡입력이 좋네용 엄마도 사야한다고 하셨는데 추천해드려야겠어요 ㅎㅎ
"128,990",평점5,테팔,21.09.20.,테팔 TY6545KL,명절과겹쳐 늦은배송예상했는데 빨리도착했어요.감사합니다.사용해본 제품이라 망설임없이 구매했습니다.
"128,990",평점4,테팔,21.09.20.,테팔 TY6545KL,좋지만 쓸때마다 흡입되는 부분이 자꾸 들려요 그리고 빨리는 부분이 회저ㄴ을 해서 걸린 머리카락을 제거하기가 히ㅁ듭니다
"128,990",평점5,테팔,21.08.20.,테팔 TY6545KL,강아지를 키우니 털때문에 청소를 자주해야 되서 구매쌨습니다복잡하고 다기능대신 심플한 본제뿜이 딱입니다가성비 최고^^
"128,990",평점5,테팔,21.08.20.,테팔 TY6545KL,힘도 너무 좋고 그동안 이가격대 청소기 전부 고장나거나해서 버렸는데 오래썼음좋겠네요~
"128,990",평점5,테팔,21.09.03.,테팔 TY6545KL,"매번 발로 앞에 꺾이는거 잡아주는거 빼곤,. 최고입니다 구석진곳에는 라이트 때문에 머리카락 먼지 잘보여서 좋아용"
"128,990",평점5,CJ온스타일,21.12.25.,테팔 TY6545KL,정말 최고입니다. 가격도 저렴하고 대 만족입니다.  특히  우리  엄마  정말 만족한다고 좋아하십니다.
"128,990",평점5,옥션,22.01.02.,테팔 TY6545KL,빠른 배송 감사합니다
"128,990",평점5,G마켓,21.12.13.,테팔 TY6545KL,무게가 적당하고 디자인 예뻐요 간단히 청소하기에 괜찮습니다
"128,990",평점5,테팔,21.12.12.,테팔 TY6545KL,모두굿 사용이 특히 편함가성비 짱메인청소기 보조로도 딱
"128,990",평점4,테팔,21.12.05.,테팔 TY6545KL,소음이 좀 있긴해요. 먼지통 분리도쉽고 만족합니다
"128,990",평점5,테팔,21.09.15.,테팔 TY6545KL,빠른 배송과 저렴한 가격 만족 스러움
"128,990",평점5,테팔,21.09.05.,테팔 TY6545KL,이사전이라 이사갈집에서 쓰려고 미리주문해놨어요 배송은 빨랐습니다
"128,990",평점5,테팔,21.12.30.,테팔 TY6545KL,안망가지고 잘 쓰고있습니다
"128,990",평점3,테팔,21.09.12.,테팔 TY6545KL,간편하고 사용하기 좋아요
"128,990",평점5,롯데ON,21.12.18.,테팔 TY6545KL,가격저렴하게잘샀습니다~
"128,990",평점5,롯데ON,21.12.21.,테팔 TY6545KL,배송빠르고 만족합니다
"128,990",평점5,테팔,21.12.21.,테팔 TY6545KL,싸게 잘사서 좋았어요!!
"128,990",평점5,테팔,21.08.24.,테팔 TY6545KL,쓰기  편해서 좋아요
"128,990",평점5,테팔,21.09.12.,테팔 TY6545KL,깔끔하고 편리해요.
"128,990",평점5,테팔,21.08.30.,테팔 TY6545KL,재구매 상품입니다. 교실에서 쓰려고요.선생님들이ㅡ좋다고 하네요
"128,990",평점5,테팔,21.12.23.,테팔 TY6545KL,잘받았습니다 감사합니다
"128,990",평점5,옥션,21.12.10.,테팔 TY6545KL,배송도 빠르고 집에서도 쓰고 있는 테팔제품이고 사무실에서 쓰려고 구입했는데 만족합니다~^^
"128,990",평점5,테팔,21.08.04.,테팔 TY6545KL,전에 같은 제품쓰다 오래 쓰기도했고 고장이 나서 똑같은거 주문했어요막쓰기 좋고 편리해요 가성비 최고입니다 ^^
"128,990",평점5,옥션,21.12.06.,테팔 TY6545KL,예전에 사용하던게 2년되지 배터리도 안좋고 부러저서 재구매합니다. 비싼것도 2년인데 가성비 최고입니다
"128,990",평점5,CJ온스타일,21.12.22.,테팔 TY6545KL,원룸에 사는 조카에게 보냈는데 아주좋타고 하네요
"128,990",평점5,테팔,21.08.30.,테팔 TY6545KL,가볍고 한번 충전으로 24평 사용하기 충분합니다.
"128,990",평점5,롯데ON,21.12.06.,테팔 TY6545KL,가볍고 설치도 쉽고 자가로 스탠드되서 좋네요^^
"128,990",평점5,롯데ON,21.08.23.,테팔 TY6545KL,"생각대로 가볍고, 청소가 잘 되네요. 만족해요."
"128,990",평점5,인터파크,21.12.11.,테팔 TY6545KL,전에 일렉 무선 청소기 썼습니다. 가격 10만원 정도 차이가 나는데 싼 만큼 흡입력이 떨어지긴 하지만써브 청소기로 쓰기에 가성비 좋습니다.
"128,990",평점5,CJ온스타일,21.08.24.,테팔 TY6545KL,재구매입나다샤로 산 게 좋긴 좋네요
"128,990",평점5,테팔,21.08.18.,테팔 TY6545KL,부드럽게 잘밀리고 흡입력도 좋네요!
"128,990",평점5,테팔,21.08.16.,테팔 TY6545KL,가볍고청소잘되고넘좋음
"128,990",평점5,옥션,21.12.23.,테팔 TY6545KL,2개째 쓰고 있어요. 싸서
"128,990",평점5,G마켓,21.12.16.,테팔 TY6545KL,저렴하고 좋아요~~~:;
"128,990",평점3,테팔,21.08.20.,테팔 TY6545KL,기존 쓰던것보다 가벼워서 좋은데제조년월일도 나와있지 않고 충전해서 사용하는데 집이 넓지도 않은데 밧데리 소모가 빨리되는듯해요..기존것도 테팔이고 14.4v 제품사양같습니다
"128,990",평점4,테팔,21.08.21.,테팔 TY6545KL,"친정엄마 선물로 구입했어요아직 선있는 청소기,흡입력도 떨어진대서괜찮은 가격에 다른후기도 좋아서구입했습니다편하게 잘쓰고있다고 엄마테 전화받았어요:)좋은 상품판매 감사합니당"
"128,990",평점4,테팔,21.08.04.,테팔 TY6545KL,가볍고 쓰기 편하고 좋네요 근데 동그란 알갱이(펠렛)같은거는 잘 안 치워져요 그것 빼곤 괜찮아요!
"128,990",평점5,G마켓,21.12.12.,테팔 TY6545KL,흡입력 그정도면 괜찬고 청소하고 아무데나 세워둘수있어 참좋읍니다
"128,990",평점5,테팔,21.07.30.,테팔 TY6545KL,가볍고 흡입력도 괜찮아요.전에 같은 제품 썼는데 만족해서 새로 또  구입해서 잘쓰고 있어요
"128,990",평점5,테팔,21.11.29.,테팔 TY6545KL,배송도 빠르고 가격도 저렴하고 성능도 괜찮네요
"128,990",평점5,G마켓,21.11.29.,테팔 TY6545KL,이모가 청소기좀 시키라해서요 좋아요
"128,990",평점5,롯데ON,21.12.15.,테팔 TY6545KL,사용전입니다. 보기에는 좋아보여요.
"128,990",평점5,CJ온스타일,21.12.05.,테팔 TY6545KL,아주 맘에 들어요..
"128,990",평점5,테팔,21.08.18.,테팔 TY6545KL,불이 켜저 작은 먼지도 볼 수 있어 편하고 어디든 세워 둘 수 있어서 좋아요^^
"128,990",평점5,옥션,21.12.12.,테팔 TY6545KL,싸고 좋습니다
"128,990",평점3,CJ온스타일,21.12.02.,테팔 TY6545KL,방금 작동해보고 깜작놀랐어요.  시끄러워서 아침저녁은. 민원들어올거같고 낮시간에만 세컨청소기로 사용해얄것 같아요.테팔이라 걍 구입했는데 여튼 사용은 합니다.
"128,990",평점5,G마켓,21.12.04.,테팔 TY6545KL,좋아요 좋아요 좋아요 좋아요 좋아요 좋아요
"128,990",평점5,테팔,21.08.03.,테팔 TY6545KL,딸 자취하는집에 사줬는데 좋아서 비슷한것을 찾아서 샀는데 저렴하고 좋아요
"128,990",평점5,테팔,21.07.26.,테팔 TY6545KL,가벼워서 부담 없이 청소하기에 너무 좋아요. 충전하면 오래가지는 않는 것 같아서 항상 충전해 두고 사용하고 있어요
"128,990",평점4,테팔,21.08.01.,테팔 TY6545KL,사용할때 자꾸 헤드 부분이 들려서 수시로 눌러줘야하네요 ㅜㅜ
"128,990",평점4,옥션,21.11.27.,테팔 TY6545KL,엄마 서드렷는데 잘 사용하고 잇다고하시네요
"128,990",평점3,테팔,21.08.04.,테팔 TY6545KL,깔끔하고 소음소리가 좀있네요.
"128,990",평점5,테팔,21.12.04.,테팔 TY6545KL,좋은제품 잘받았습니다.~^^
"128,990",평점5,테팔,21.07.13.,테팔 TY6545KL,너무 조아요~맘에들어요
"128,990",평점5,옥션,21.12.01.,테팔 TY6545KL,잘 받앗어요
"128,990",평점5,CJ온스타일,21.07.25.,테팔 TY6545KL,배송 잘 받았습니다. 테팔 에어포스 라이트 무선 청소기  제품을 구매했습니다. 아이 오피스텔  청소기가 고장이나 어떤거 살까 고민하다 소리도 적고 흡입력이 좋다고 해서 구입했는데 아이가 좋다고 하네요. 감사합니다~~
"128,990",평점3,CJ온스타일,21.11.22.,테팔 TY6545KL,평대로 소리가  좀큰데  그리 크진않아요  청소기소니보라 바퀴소리가  더 크거든요 바퀴때문에  이동이 쉽다했는데  막 돌아가요~그래도  흡입력은  좋아요  잘세워지고  오히려바퀴가  방해되는거  말고는  괜찮아요
"128,990",평점5,롯데ON,21.11.24.,테팔 TY6545KL,디자인도 이쁘고 기능적인 조작법도 간단해서 사용하기 편리하네요.   가격대비 제품이 너무 좋은것 같아요.
"128,990",평점5,롯데ON,21.11.13.,테팔 TY6545KL,가성비갑인 제품입니다똑같은제품 4년정도 썼는데 밧데리 교체시기가 되서그냥 새상품으로 구매합니다.조립시 중간 선때문에 약간 애먹었어요
"128,990",평점5,CJ온스타일,21.07.30.,테팔 TY6545KL,부모님이 튼튼해서 좋다고 하십니다. 저도 7-8년 쓰고 있는데 테팔은 고장이 없네요. 
"128,990",평점4,CJ온스타일,21.07.12.,테팔 TY6545KL,싱글라이프 시작한 20대 조카를 위한 젭들이 선물로 보냈어요. 맘에 들어하네요~
"128,990",평점5,롯데ON,21.11.21.,테팔 TY6545KL,반신반의로 구매했는데 완전 만족해서 여러군데 선물했어요
"128,990",평점4,CJ온스타일,21.11.21.,테팔 TY6545KL,무선청소기 처음인데  가볍고 아주 편하네요 다만 헤드쪽이 계속 들려서 계속 내려줘야 합니다
"128,990",평점5,테팔,21.11.14.,테팔 TY6545KL,좋아요 배송도 빠르고 물건도 마음에 듭니다!
"128,990",평점5,G마켓,21.11.20.,테팔 TY6545KL,유선보단 힘이 약하지만 사용하긴 편하너요
"128,990",평점5,롯데ON,21.11.23.,테팔 TY6545KL,잘사용할게요     저렴한가격에잘샀어요
"128,990",평점5,테팔,21.07.13.,테팔 TY6545KL,간단한 바닥청소용으로 구매 좋아요
"128,990",평점5,옥션,21.11.21.,테팔 TY6545KL,청소 잘됩니다만 소음이 좀 있네요.
"128,990",평점4,SK스토아,21.02.26.,테팔 TY6545KL,가볍게 사용하기에는 나쁘지 않으나 회전이 안되서 직진만 청소가 가능하네요.. 헤드부분이 고정이 되지 않아서 자꾸 들려요. 한번 사용했는데 머리카락이 엄청 감기네요. 그래도 저렴하니 만족합니다.
"128,990",평점5,롯데ON,21.11.16.,테팔 TY6545KL,간편하고흡입력도괜찮아요~
"128,990",평점4,테팔,21.11.24.,테팔 TY6545KL,가볍고좋아요 청소잘되요
"128,990",평점5,CJ온스타일,21.11.18.,테팔 TY6545KL,감사합니다 수고하세요 
"128,990",평점5,인터파크,21.11.18.,테팔 TY6545KL,빠른 배송 감사해요!!
"128,990",평점5,테팔,21.07.28.,테팔 TY6545KL,"잘 받았어요, , ,"
"128,990",평점5,테팔,21.07.30.,테팔 TY6545KL,싸게 잘샀아요 좋아요
"128,990",평점5,테팔,21.06.28.,테팔 TY6545KL,무선은 처음 써보는데 너무 편해요~가볍고 한번 충전으로 24평은 충분하고도 남아요.가성비 짱입니다.
"128,990",평점5,테팔,21.06.23.,테팔 TY6545KL,같은제품 쓰다 고장나서 새로구입했어요. 사용하기 편해서 재구매 했습니다. 가격도 좋아요
"128,990",평점4,롯데ON,21.11.18.,테팔 TY6545KL,여러가지 비교하다가  구매했어요. 직장 사무실에서 사용할 거구요. 믿고 구매했어요.
"128,990",평점5,테팔,21.11.05.,테팔 TY6545KL,가격대비 너우좋아요. 흡입력도 좋고 가벼워서 청소하기도 편하고
"128,990",평점5,테팔,21.11.08.,테팔 TY6545KL,사용할수록 마음에 들어요 청소하는 시간이 편해졌어요먼지말고 머리카락도 잘들어가고왠만한건 다 들어가네요고장안나고 오래썼으면 좋겠어요
"128,990",평점5,인터파크,21.11.10.,테팔 TY6545KL,테팔 에어포스 라이트 무선청소기 TY 6545 잘받았습니다
"128,990",평점5,테팔,21.11.12.,테팔 TY6545KL,어머님 사드렸는데 가벼워서 매우 좋다고 하시네요.
"128,990",평점5,11번가,21.11.10.,테팔 TY6545KL,사용하기편하고 가볍고 흡입력도 아주 좋습니다
"128,990",평점4,테팔,21.11.05.,테팔 TY6545KL,무겁긴하네요그것빼곤 대체적으로 괜찮습니다.
"128,990",평점5,테팔,21.11.04.,테팔 TY6545KL,빠른 배송 최고입니다.청소기가 가볍고 좋아요
"128,990",평점5,G마켓,21.11.10.,테팔 TY6545KL,흡입력 괜찮아요소리는 커요저렴한 가격이 가장 좋아요무게는 생각보다 무겁네요
"128,990",평점5,테팔,21.11.05.,테팔 TY6545KL,베리굿 가성비최고 틈새흡입기구없어 아쉬움
"128,990",평점5,CJ온스타일,21.07.19.,테팔 TY6545KL,좋은상품 잘받아 사용중입니다
"128,990",평점5,G마켓,21.11.11.,테팔 TY6545KL,잘 사용중입니다.  테팔 청소기
"128,990",평점5,테팔,21.11.07.,테팔 TY6545KL,빠른배송 감사합니당
"128,990",평점5,SK스토아,21.06.13.,테팔 TY6545KL,저렴하고 배송도 빠르고 좋습니다. 청소하기가 수월하고 무선이라 편리하네요. 헤드가 잘 돌아가고 흡입력이 좋습니다. 
"128,990",평점5,11번가,21.10.23.,테팔 TY6545KL,깔끔한 블랙 칼라에 디자인도 고급져요.가볍고 흡입력도 좋은데 모터소리보다 바닦에 긁혀서 굴러가는 소리가 더 신경쓰여요.저렴한 가격에 탁월한 선택이예요.
"128,990",평점4,테팔,21.08.19.,테팔 TY6545KL,잘받았습니다 잘받았습니다
"128,990",평점5,롯데홈쇼핑,21.10.27.,테팔 TY6545KL,배송받자 하루 지나 가격이 119000원으로내려가서 기분이 좋지 소음이 심하며 바퀴소리가 마루에 밀대 너무 시끄러워 저녁 사용은 신경이 쓰여요
"128,990",평점5,G마켓,21.11.10.,테팔 TY6545KL,무선이라좋아요흡입력은강하지않지만좋아요
"128,990",평점5,CJ온스타일,21.10.22.,테팔 TY6545KL,예상배송일 보다 빨리 도착했고 아주 잘 돌아가고 좋아요.  흡입구 헤드부분이 들리긴 하는 게 좀 귀찮아요
