가격,평점,채널,날짜,제품명,리뷰
"343,100",평점4,테팔,21.11.19.,2020년형테팔 TY5510,"가성비 좋게 잘 산 것 같아요. 충전시간에 비해 청소기를 돌릴 수 있는 시간이 너무 적은 것 같아서 사기 전에 고민을 많이 하긴 했는데 역시나 그 부분을 제외하고는 다 만족스럽네요. 손목에 너무 부담을 주는 무게도 아니고, 거치대가 있어 설치도 깔끔하게 할 수 있고 흡입력도 나쁘지 않아요.디자인도 마음에 듭니다."
"343,100",평점3,테팔,22.01.05.,2020년형테팔 TY5510,이곳에서 제일 저렴하게 구입했네요배송은 성탄절 연휴 고려하면 빨리 배송되었어요엄마가 쓰실거라 가격이랑 여러가지 고려해서 구입유선을 쓰시다 쓰신거라 무선의 단점으로 아직까지는 맘에 들어하지 않으시네요무겁고 유선보다 흡입이 시원하지 못하다보니처음에는 머리카락도 잘 흡입ㅇㅣ안된다며 화가 나셨다고 하네요조금 적응하다보면 조금 나아질듯도 한데 아쉬워하셨어요
"343,100",평점5,테팔,21.12.17.,2020년형테팔 TY5510,맘에 들어요 흡입력도 좋고 목(?)도 자유자재로 움직여서 편해요 다만 저희 부모님께서는 너무 거추장스럽고 존재감이 너무 크다고 싫어하시네요 ㅋㅋ 소음은 그냥 청소기 소음이에요 딱히 작은지는 모르겠어요 청소기 거치대 사은품으로 잘 받아서 잘 쓰고있습니다 ㅎㅎ
"343,100",평점5,테팔,21.11.27.,2020년형테팔 TY5510,가성비 갑. 색상을 고를수 없는건 아쉽지만 오랫동안 검색해보고 리뷰 보면서 고민한 보람이 있습니다. 스탠드에 녹이 좀 슬어있긴했는데 큰 문제 아니니꺼 그러려니 합니다. 가볍고 소음 적고 흡입력좋아서 마우 만족합니다. 친구집에 엘지 100만원짜리 무선 청소기보다 훨 나아요.
"343,100",평점5,테팔,21.11.01.,2020년형테팔 TY5510,유선 청소기 보다는 조용하네요.처음 사용해서 그런지 무겁게 느껴집니다.다른 제품을 사용한적이 없어서 비교는 불가하지만 소음도 적당하고 청소도 잘되는것같습니다.배터리 잔량 알림이없어서 돌아갈때 까지 사용중인데 34평 청소하고도 배터리가 남았는지 잘돌아갑니다.거치대도 마음에 듭니다. 단지 중간 볼트는 구멍이 잘안맞아서 들어갈 수 있는 만큼만 조여났네요.
"343,100",평점4,테팔,21.12.11.,2020년형테팔 TY5510,흡입력-오…..이 정도면 흡입력 좋다고 할수있을꺼 같습니다.배송-깔끔하고 빠른편입니다.디자인-군더더기 없고 디자인굿단점-거치대에 꼽아야 충전되는 시스템..그냥 아답터로 충전하는게 편할듯궁금점-모델명 뒤에 ks붙는거랑 붙지않는거랑별로 다른점을 모르겠는데 가격은 차이가 남..
"343,100",평점5,테팔,21.12.05.,2020년형테팔 TY5510,후다닥 조립하고 청소기 돌렸는데 흡입력이 너무 좋습니다 특히 부스터 모드는 유선청소기와 별반 다르지 않은 흡입력… 소리도 앵앵거리는 소리가 아니라 부우웅소리가 아주 d 깔려서 조용히 납니다 배터리 분리형이라 좋구요 무선청소기 뭐 타사 100만원 가까이 주고살 필요없습니다 테팔 ty5510 이 가성비 갑이고 공식홈이 가장 저렴합니다!!
"343,100",평점3,테팔,21.11.27.,2020년형테팔 TY5510,한달 이상 사용 후기입니다.우선 거치대가 청소기 바닥과 일치 하지 않아 좀 당황 스러웠지만 고정은 되는지라 그냥 사용합니다.다른 분들 청소기는 거치대가 잘 맞는지 궁금하내요.ㅎㅎ흡입력은 엄청 세진 않아요.그래서 성격 급하시거나 깔끔하신 분들께는 비추입니다.그러나 그런데로 쓸만하고 고양이 털도 그런데로 잘 흡입합니다.그리고 부드럽게 잘 밀리기 때문에 천천히 하셔야 흡입이 잘 됩니다.한가지 아쉬운 점은 흡입 강도가 없다는 거에요.그래서 먼지가 많이 쌓인 곳은 물티슈로 한 번 더 닦아내야하는 번거로움이 있으니 이게 싫으신 분들은 흡입 강도가 있는 것을 추천드립니다.유선 청소기가 이 가격이면 그런데로 만족할 만한 제품이었을 것 같아요.하지만 무선 청소기이고 테팔 이라는 것을 감안하면 별 세개 반 정도 주고 싶은데 반개는 안되나봐요 ㅎㅎㅎ
"343,100",평점5,테팔,21.10.24.,2020년형테팔 TY5510,테팔청소기 두번째 구입입니다. 예전버전은 소리가 크고 무거웠는데 그 제품과 비교하면 가볍고 핸들링도 부드럽습니다. 고무줄같은 것은 한번에 흡입되진않아요 밀착되지않으면 튕겨나가거나 빨려들어가지 않는것같아요 특성에맞게 요령껏 사용하면 좋을것같아요. 오래도록 잘썼으면 좋겠습니다. 저희는 일단 두제품 혼용해서 써보려고요~~^^*
"343,100",평점5,테팔,21.11.17.,2020년형테팔 TY5510,사무실용으로 구매했습니다.. 이런 무선용 핸디 청소기는 너무 고가라 20만원 대에서 뭘 사야 할지 모르겠어서 고민하다가 테팔 브랜드 이미지 생각하고 구매했는데 좋은것같아요 잘 사용하겠습니다. 아직 청소는 안해봤찌만.. 잠깐 돌려본 바로는 생각보다 파워가 약한줄 알았는데 흡입은 잘되더군요~
"343,100",평점4,테팔,21.12.26.,2020년형테팔 TY5510,밧데리용량을 제대로 확인못하고산게 잘못이긴하지만배송빠르고 제품 가볍고 사용하기편합니다단 보조밧데리를 하나더 구매해야 강모드이용시32평정도되는 아파트청소가 가능할듯해 구매할예정입니다 구매하실분들은 참조하세요
"343,100",평점5,테팔,21.11.09.,2020년형테팔 TY5510,언니가 무선 청소기 하나 주문해달라고해서 찾아보다가 브랜드 믿고 테팔제품 선택했어요처음엔 좀 더 저렴한 제품을 구매했는데 이 제품이 자꾸 눈에 아른거려서구매취소하고 이걸로 다시 주문했네요디자인이랑 기능 둘다 너무 좋은것 같아요 거치대도 사은품으로 주고..언니가 너무 가볍고 소리도 적고 흡입력도 좋다고 청소기 너무 좋은거 잘샀다고 좋아했습니다청소기 덕분에 삶의 질이 올라갔다네요 ㅎㅎ다음번에 제거 살때도 테팔제품으로 구매해야겠어요 ^^
"343,100",평점5,테팔,21.11.15.,2020년형테팔 TY5510,라이트라서  가벼울줄 알았는데 무게는 다이슨과  중국가성비모델  중간쯤   흡입력은  좋습니다  가격대비  좋은상품이네요  먼지통비우는것도  편하고요  손잡이방아쇠밑부분을 좀더길게만들었으면 좋을듯합니다  손가락네개가 들어가게요   아무튼가성비모델로는  괜찮은 모델입니다
"343,100",평점5,테팔,21.10.21.,2020년형테팔 TY5510,배송도 빠르고제품도 가격대비 성능이 너무 좋네요전에 iroom16만원 짜리 써봤는데 파워면에서 비교자체가 불가할정도로 압도적으로 테팔이 좋네요제가 엘지나 다이슨 청소기를 써보진 않았지만 이가격에 이정도 퀄리티의 제품을 산다면 굳이 고려해 볼 필요가 없지 않을까 싶을정도로 정말 마음에 듭니다
"343,100",평점5,테팔,21.10.20.,2020년형테팔 TY5510,받자 마자 조립해서 테스트함. 일단 가볍고 조용함. 조용해서 청소는 잘 되나? 의심했는데 먼지는 먼지통에 많이 쌓여 있었슴. 청소기 앞 헤드가 부드러워서 그동안 유선청소기 드르륵하면서 시끄러워서 밑에 집 시끄러울까 걱정했는데 편안하게 청소해도 될것 같음.
"343,100",평점5,테팔,21.11.16.,2020년형테팔 TY5510,"어떤 청소기를 사야하나 고민하다가여러가지 비교해본 후 구입했습니다. 일단 조립도 어렵지 않아 좋았고, 작동도 잘 되네요!흡입하는 소리가 작아서 청소가 잘 되려나? 싶었는데 걱정과는 달리 흡입도 문제 없네요!보내주신 거치대도 잘 쓰겠습니다. 감사합니다!"
"343,100",평점5,테팔,21.11.15.,2020년형테팔 TY5510,"역시 테팔입니다. 제품 마감이나 이음새도 너무 깔끔하고,, 이벤트기간이라 거치대 까지 받은게 정말 신의 한 수 인 것 같아요.. 흡입력이나 사용감은 뭐 말할것도 없고요.. 진짜 저렴한 청소기도 많고 비싼 브랜드청소기도 많지만 딱 적정선에서 모든걸 겸비한 청소기는 이 청소기네요.."
"343,100",평점5,테팔,21.10.29.,2020년형테팔 TY5510,우연히 라이브쇼핑 보다가 가격이 괜찮아서 부모님께 선물 드렸어요~ 아주 가볍다고 했지만 여느 무선청소기만큼의 무게라고 하십니다 거치대가 포함된 가격이라는게 너무 좋네요~! 문의사항에 배터리 말이 많던데 오래사용할 수 있길...
"343,100",평점5,테팔,21.11.12.,2020년형테팔 TY5510,일단 조립은 어렵지 않았구요아직 제대로 충전해서 써보진 않았지만다른 청소기들보다 소음은 확실히 덜하네요청소기 고장으로 맨날 손걸레질하고 있던터라 그닥 더러울꺼 없었는데도 먼지통에 먼지가 들어 있는거보니 흡입력도 괜찮은듯요
"343,100",평점4,테팔,21.10.21.,2020년형테팔 TY5510,아기가 있어서 무선 청소기가 필요했는데 마침 가격이 좋아 구매하게 되었어요.아직 많이 사용하지는 않았지만 사용감 괜찮아요.소음도 심하지 않고 흡입력이 아주 강하다는 느낌은 못 받았지만 잠깐 청소기 돌리고 난후 먼지통을 확인해 보니 꽤 모여 있더라고요.이틀 사용한 결과 만족합니다.
"343,100",평점4,테팔,21.12.26.,2020년형테팔 TY5510,낑낑대면서 거치대조립하고(구멍 와꾸 잘 안맞음)기대반 걱정반으로  작동했는데..ㅎㅎㅎ 그냥 쓸만해요우와ㅏㅏ는 아니구요 ㅎ저한테 제일 별로인 단점은머리카락이 밑에붙어서 따라다녀요손으로 먼지 다 떼어줘야합니다ㅠㅠ그리고 바퀴?가 두개있는데 처음에 사진보고도 모르고 사서 ㅋㅋㅋ 갑자기 모르는 사람이랑 눈마주친기분입니다
"343,100",평점4,테팔,21.12.30.,2020년형테팔 TY5510,유선청소기만 쓰다가 고장이 났는데 방이동 할때마다 코드뽑아야 하는 번거로움이 없어서 참 좋아요.소음도 크지않아 괜찮은데 흡인력은 생각보다 약하네요.1단만 있다는게 좀 아쉽네요.강한 흡입이 필요할때 여러번 왕복으로 밀어야하는게 번거롭네요
"343,100",평점5,테팔,21.10.21.,2020년형테팔 TY5510,일단 가벼워서 너무 좋구요핸들링이 어머 세상 부드럽고 각도가 럼청 크게 돌아가요 거치대에 놓우며누자동충정 되는것도 너무 베리굿 저는  너무 만족하고 다음번에도 테팔쓸꺼에요 후라이팬만 테팔쓰다가  청소기까지 너무 반했습니다
"343,100",평점5,테팔,21.03.09.,2020년형테팔 TY5510,테팔 냄비후라이팬 드라이기 커피포트 등등이번 청소기도 같은 모델 재구매에요.고급 엘지가전에 비해 저렴한 가격 뒤떨어지지 않는 성능 테팔만세 테팔청소기만세. 근데 원래 이 가격이었나요? 똑같은 모델 전에 샀는데 조금 오른거같아요. 아쉽지만 머 그래도 샀어요. 대체재가 없으니까요.  테팔만세.
"343,100",평점5,테팔,21.11.15.,2020년형테팔 TY5510,무선이라 좋구요. 가벼워서 더 좋아요.S전자 유선 사용했었는데 흡입력도 비슷하구요. 먼지 비우기도 편하고 조립하기도 완전 수월해요. 충전도 간편하고~ 어머님이 제가 사용하는거 보시고 원하셔서 사드렸네요. 완전 대만족입니다~^^
"343,100",평점5,테팔,21.10.28.,2020년형테팔 TY5510,충분한 타 리뷰등을 검토 가격비교 후 주문함.20년도상품세일행사로 합리적가격으로 판단됨.배송예상일 주문폭주로 인해 하루 늦어진거 빼고 모두 만족하고 있슴.본품배송 이튿날 거치대까지 따로 배송와서 잊고있다가 한번더 만족함.   ?이상?
"343,100",평점5,테팔,21.10.17.,2020년형테팔 TY5510,테팔에어포스360 반신반의 하고 구매했는대 진짜 비싼 엘지 삼성 다이슨 살필요없네요 사기전에 유명 무선 청소기 비교 유트브 보고 구매 했는대 실화 입니다 정말좋아요 테팔 바닥에 잔먼지 까지 다쓸어담습니다 흡입력도 좋아요 쇼파옆작은 공간도 거치대 까지 쏙들어갑니다 강추해요
"343,100",평점5,테팔,21.12.18.,2020년형테팔 TY5510,저희 부모님댁과 시댁에 하나씩 선물해드렸어요정말 가볍고 깨끗하게 청소되고 소음도 정말 적네요저희집은 삼*비스포크 제품을 쓰는데 그것보다 더 좋은 느낌이에요 ㅋㅋㅋ 부모님들께서는 가벼운게 최고인거같아요~~ 기분좋은 선물이 되어 넘 기분 좋네요
"343,100",평점5,테팔,21.11.10.,2020년형테팔 TY5510,"묵직한 청소기 싫어하시는분 무조건 강추합니다. 이정도 가격에 비하면 타사제품과 성능, 흡입력 별차이 없고 특히 타사 고가제품과 비교시 제일 가볍습니다. 저희집에서 L사, D사 제품 써본 경험과 대형마트에서 S사 제품도 만져본 결과 말씀드립니다."
"343,100",평점5,현대Hmall,21.05.20.,2020년형테팔 TY5510,모터가 위에 있어서 한손조작이 조금 힘들긴 한데 모든 무선 청소기의 단점이니 신경쓰이진 않습니다매트리스나 이불 청소헤드가 있어서 이게 정말 좋아요강아지가 털이 빠지는데 매일 침대 패드 청소하니 정말 깔끔합니다조립도 쉽고 흡입력도 좋아서 좋은 가격에 구매한것 같아요봉 부분이나 부분 포인트 컬러는 로즈골드에요 참고하세요
"343,100",평점5,테팔,21.11.25.,2020년형테팔 TY5510,이전에 장난감같은 청소기를 써서 그런지 가볍게 느껴지진 않아요 ㅋㅋ 그래도 다이슨보다는 훨씬 가벼운 것 같네요. 성능 너무 좋아요. 먼지쓰레기 버리기도 정말 수월하고 거치대 같이 올 줄 몰랐어요!! 못을 박아야하나 했는데ㅠㅠ 거치대 짱!!
"343,100",평점5,테팔,21.12.13.,2020년형테팔 TY5510,엄마 먼저 사드리고 만족스럽다고 해서 저도 구매했어요~ 무선청소기 이거 정말 신세계네요~ 밀리는것도 부드럽게 잘 밀리고 소리도 작아서 좋아요~ 가볍지는 않고 배터리 잔량 표시 없는게 좀 아쉽긴 하지만 청소가 잘되는것 같아 만족합니다 잘쓸께요~
"343,100",평점5,테팔,21.12.25.,2020년형테팔 TY5510,배송도 엄청 빨랐구요. 다양한 구성품이있어서 좋아요.정리하는것도 거치대를 2가지 타입으로 선택할 수 있어서 마음에 들어요.흡입력도 좋고 바닥에서 힘들이지 않고 밀어도 잘 밀리구요.크리스마스이브날 배송이와서 선물받은 기분이였어요 ㅎㅎㅎ
"343,100",평점5,테팔,21.11.08.,2020년형테팔 TY5510,매우 부드럽게 잘 되요^^청소도 잘되고 ㅎㅎ다이슨 8쓰다가 오래되서 바꿨는데 소음고 적고 가볍고 거치대까지 주는데 가격도 착하고 ㅎㅎ 반려묘 있어서 매우 고심하다 골랐어요. 카펫에 붙은 작은 털은 발 안빨리지만 무난하게 잘 쓰고 있습니다. ^^
"343,100",평점5,테팔,21.11.28.,2020년형테팔 TY5510,일단 구매전에 리뷰를 꼼꼼히  읽고 다른제품과 비교후 구매 했는데요... 소음도 작고 파워도 좋아 먼지도 깔끔하게 흡입하네요... 다이슨도 청소하고 나면 곳곳에  머리카락이며 먼지가 남던데 말이죠.. 다른제품과 비교해서 가격도 너무 좋구 성능도 좋아 아주 만족합니다??
"343,100",평점3,테팔,21.11.07.,2020년형테팔 TY5510,일단 디자인이랑 색상이 너무 이뻐요ㅎㅎ다*슨청소기 한참전에 모델 사용하다가 이번에 이사하면서 청소기 바꿨는데 다*슨 굉장히 만족하면서 몇년동안 사용했었는데요소리가 좀 컸는데 얘는 진짜 조용하네요아직 많이 사용은 안했지만 흡입력은 잘 모르겠어요ㅎ거치대 다른분들은 따로 배송 받으셨단 분들도 계셨는데 저는 한꺼번에 같이 왔고 배송도 빨라서 좋았어요
"343,100",평점5,테팔,21.11.18.,2020년형테팔 TY5510,타사제품 살까 고민하다가 네이버 검색중에 테팔청소기를 알게되었어요. 금액대비 후기가 좋다는 상품평 믿고 구매했어요.배송도 빠르고.사용해보니 만족합니다.단 거치대가 힘이없고 나사도 안맞지만..사은품으로  주신거니 고맙게 사용하겠습니다.좋은가격에 잘 사용하겠습니다.
"343,100",평점5,테팔,21.03.08.,2020년형테팔 TY5510,예전 쓰던 다이슨이 고장나서 전자 제품 전시장에서 비교해보고 샀어요. 다이슨보다 가볍고 핸들링도 아주 좋습니다. 또한 청소통 부분이 믹서기통처럼 분리 및 세척이 좋아서 아주 만족스럽습니다. 그리고 꼭 벽걸이를 안하고 바닥에 분리 설치가 가능합니다. 흡입력도 다이슨 보다 좋은거 같습니다.
"343,100",평점4,GSSHOP,21.04.27.,2020년형테팔 TY5510,만족하며 쓰고있어요손목이 아픈 저로선청소기가 가벼운진 잘 모르겠지만다이슨을 두손으로 잡고 써야 했던것에 비하면가볍다고 해얄듯머리카락이 시원하게 빨려들어가진 않지만그건 장점10가지 중에 한가지 흠일 정도소음도 적어서 밤에 사용해도 무난하다전세라서 벽에 거치하지 않았는데저리써도 만족
"343,100",평점3,테팔,21.11.24.,2020년형테팔 TY5510,엄마께 바로 배송하고 어제 들러서 박스개봉했는데.. 안에 있는 제품박스에 위 아래로 붙어있는 새상품 스티커가 한 쪽은 찢어져서 스카치테잎으로 붙여 왔어요.. 제품은 깨끗하고 맘에 들었지만 왠지 반품된 상품을 보낸 것 아닌가 싶어 기분이 좋지는 않습니다..
"343,100",평점5,테팔,21.11.14.,2020년형테팔 TY5510,엄마네 청소기 고장나서 O던 중 행사가격에 거치대까지 주는 테팔청소기~~일단 가격면에선 오호~~했는데 청소기에 생명력은 흡입력이기에 구매후기를 거의 다 읽어보고 결정~~총 4개구매 ㅎ ㅎ 엄마거랑 세자매 모두 요걸로 질럿음요~~근데!!!근데!!! 청소기 소음이 이렇게 작아도 되는건지~~ㅎㅎ 흡입력도 무선이 이렇게 좋아도 되는건지~~왜 이제야 요 이쁜이를 맞이한건지 소음 흡입력 모두 완전만족~~너무 좋다 대만족~~다른 상품도 행사 많이 해주세요~~
"343,100",평점4,테팔,21.11.13.,2020년형테팔 TY5510,Ty9086테팔쓰다 3년만에 고장나서 다시 테팔로구매했어요.Ty9086너무 잘쓰고 흡입력도 좋아서...근데 이번에 구매한 테팔은 방2개밀면 끝이네요 거실은 밀지도못하고ㅠ전에 쓰던건 거실도 방도 침구도 다 밀어도 충분했는데이번껀 부스터로 하면 방2개도 못밀고 끝나요ㅠ 부스터 안씀 흡입력도약한것같아요.
"343,100",평점1,테팔,21.10.27.,2020년형테팔 TY5510,청소기 거치대는 따로 보내주셨던데 나사가 하나도 없어서 전화했더니 나사보내준다더니 잠시 뒤에 전화와서 나사 못보내준다고 합니까? 나사 없으면 거치대가 무슨 소용이나요? 사은품이 아니라 고철덩어리를 보내놓고 나사안보내겠다고 하는건 너무 무책임한거 아닙니까? 테팔 브랜드가 이렇게 허접한줄 다시 보게 되네요.
"343,100",평점5,테팔,21.11.14.,2020년형테팔 TY5510,저희집 다이*  사용하고있구요친구추천으로 청소기구입하게 되었습니다청소기를 처음돌릴땐 다이*보다 약간  아주약간 흡입력이 적다 라는 느낌이지만 부스터를 켜면 다이*보다 더 좋다는 생각이고다음에 구입시에도완전강추예정입니다
"343,100",평점5,GSSHOP,20.09.09.,2020년형테팔 TY5510,테팔청소기 너무잘쓰다가오래되어 새로바꿨네요.GS가 최저가라 구매했는데 배송도빠르고 제품도 맘에드네요.기존쓰던제품보다 훨씬가볍고 헤드가부드러워 쓰기가훨씬좋습니다. 헤드가크다고  롤링부분이큰건아닌데 헤드가전체적으로 롤링되어 청소가훨씬수월합니다.거치대도 좁은공간에딱들어가서공간도덜차지하고 미관상보기도좋고 잘어울리네요.세기는2단계이지만 일반모드도 세고 2단계는말그대로 파워흡입이네요.기존청소기3단보다센것같네요.밧데리가하나라..고민했는데 안쓸때는바로 거치대에충전할수있으니 굳이두개일필요성이없는것같네요.기존테팔청소기도8년넘게써도 밧데리고장은없어서 밧데리하나로충분할 듯 해요.청소기가들어있던 박스를 아기냥이가너무좋아해서 스크래처도하나 받은셈이?네요.^^너무만족스런제품입니다.
"343,100",평점3,테팔,21.11.05.,2020년형테팔 TY5510,청소기 자체는 좋은듯하나....배송시 부품누락도 있었고 (거치대) 그래서 전화하니 상담사가 원래 나사는 안들어있는거라는 황당한답변을해서 놀라서 다시 물어보니 그때서야 업체 확인하고 보내준다네요ㅠㅠ 지금 키높이 거치대없이 분해해서 충전해놨는데...불편하네요
"343,100",평점4,테팔,21.10.30.,2020년형테팔 TY5510,아내가 아주 만족합니다.손목이 안좋아 살짝 무거운 느낌이 있다고는 하는데 손목이 아프지 않은 분들이라면 아주 가볍다고 느낄거같다고 하네요결혼후(얼마전 20주년 지났어요) 사준 청소기중에 제일 좋다고 합니다.감사합니다.
"343,100",평점5,신세계백화점,20.12.05.,2020년형테팔 TY5510,"무선청소기를 구매하고 싶었지만 항상 무게 때문에 고민을 하다가 테팔무선청소기를 알게 되었는데 상품을 받고 사용해보니 가벼워서 너무 맘에 들어요 보관하는 거치대도 바닥 , 벽등 마음대로 설치할 수 있고 세가지 툴도 다양하게 쓸 수 있어 너무 좋아요 다이슨에 새로 나온 가벼운 제품이 있었지만 그거보다는 성능도 비슷하고 가성비가 아주 좋은 상품입니다아주 오래 망설이다 구매했어요 만족도 최상입니다^^"
"343,100",평점4,테팔,21.03.13.,2020년형테팔 TY5510,"헤드가 가구 밑으로 들어가서 좋고, 바닥 밀 때 부드러워서 아랫집 눈치 덜 보여요. 조금 무겁긴하지만 이정도는 감수할 수 있는 정도예요 :) 터보로 해야 머리카락 등 빨리 빨려들어오는 느낌이라 거의 터보로 사용중이예요. 여러모로 아직은 만족스럽습니다."
"343,100",평점5,테팔,21.10.24.,2020년형테팔 TY5510,어머니 사드렸는데 너무 간편하고 좋으시데요!알고보니 테팔꺼 살까말까 고민하셨다고 하시더군요ㅋ고민은 배송만 지연시킬뿐! 바로 구매해드렸죠.거치대와 청소기 따로 배송이 되서 착각을 했었죠ㅋ다음날 청소기 도착했네요ㅋ암튼 만족스러워 하시니 기분 좋았습니다. 감사합니다.
"343,100",평점3,G마켓,21.01.16.,2020년형테팔 TY5510,"침구 키트도 필요하고, 간단간단 하게 청소 하려는 용도에,벽걸이가 아닌 거치대를 제공해주는걸 찾다가테팔 에어포스 360 라이트 모델의 구성이 딱 맞아서 구입했습니다.그런데, 청소 중에 연장 봉이나 전원버튼 쪽에서 전기가 옵니다.다른 상품평에는 없는거 보니 뽑기 운이 나쁜건가 싶네요.아무튼 청소중에 깜짝깜짝 놀라는데,월요일 되면 AS 센터에 연락한번 해봐야겠네요."
"343,100",평점5,롯데ON,20.12.17.,2020년형테팔 TY5510,엄마가 손목 무릎도 아프시고 쓰던 유선청소기가 접촉이 잘 안되는지 되다말다 한다고 해서 사드렸네요~ 삼성 엘지 다이슨 좋은거야 다 알지만 가격이 너무 비싸서 적당한 가격대 중에 찾아보니 이게 젤 좋더라구요!! 고가라인이랑 비교해도 그리 성능이 딸리지도 않구요 ㅎ 일단 받으시고 엄마가 너무 좋아하셔서 만족합니다 ㅎㅎ 저희집 청소기도 고장나면 이걸로 바꾸려구요 ㅎ
"343,100",평점5,테팔,21.01.10.,2020년형테팔 TY5510,"첫째,가벼워서 청소기돌릴때팔이 아프지 않고둘째,소리가 작아서 소음으로 이웃에게 불편을 드리지 않아서 좋구셋째, 흡입력이 좋아 밀고 나면 깨끗해진 느낌이 나서아주아주 강추 드립니다넷째,가격이 좋습니다.부담스럽지 않아 굿!"
"343,100",평점4,GSSHOP,20.09.02.,2020년형테팔 TY5510,10만원 주고 산 비슷한 청소기에 비해 기능면은 떨어지네요헤드부분이 털로 되어 있어서 미세먼지까지 쓸어주는건 매우 좋아요근데 밧데리가 윗부분에 노출되어 있어서 더 무겁고 헤드부분에 LED빛이 없네요그리고 밧데리 용량이 어느정도 남았는지 충전할  때 표시등이 있다면 좋았을걸~~세기 단계도 2단계뿐이네요~~
